{
  "name": "rpacademy",
  "visibility": "private",
  "default_branch": "main",
  "pushed_at": "2026-06-13T13:48:49Z",
  "skills_detected": false,
  "integrations": {
    "vercel": false,
    "turso": false,
    "payhero": false,
    "brevo": false,
    "getstream": false,
    "cloudinary": false,
    "render": false
  },
  "open_prs": 0,
  "open_issues": 0,
  "workflow_count": 3,
  "failing_recent_runs": 15
}