{
  "name": "solera",
  "visibility": "private",
  "default_branch": "main",
  "pushed_at": "2026-07-01T03:51:43Z",
  "skills_detected": true,
  "integrations": {
    "vercel": false,
    "turso": true,
    "payhero": true,
    "brevo": true,
    "getstream": true,
    "cloudinary": false,
    "render": false
  },
  "open_prs": 0,
  "open_issues": 0,
  "workflow_count": 1,
  "failing_recent_runs": 20
}