{
  "name": "CRM",
  "visibility": "public",
  "default_branch": "docs/forensic-readme-update",
  "pushed_at": "2026-06-08T16:30:30Z",
  "skills_detected": false,
  "integrations": {
    "vercel": false,
    "turso": false,
    "payhero": false,
    "brevo": false,
    "getstream": false,
    "cloudinary": false,
    "render": false
  },
  "open_prs": 0,
  "open_issues": 0,
  "workflow_count": 0,
  "failing_recent_runs": 0
}